{
  "version": "0.1.0",
  "created": "2026-03-24T21:20:00",
  "patternCount": 1,
  "songCount": 1,
  "drumkitCount": 1,
  "patterns": [
    {
      "type": "pattern",
      "name": "Example Pattern",
      "url": "permalink",
      "hash": "3972dc9744f6499f0f9b2dbf76696f2ae7ad8af9b23dde66d6af86c9dfb36986",
      "author": "Name",
      "description": "Some info text explaining the artifact",
      "version": 1,
      "formatVersion": 1,
      "tags": [
        "Ufta",
        "Punk",
        "Ambient"
      ],
      "size": 3564,
      "license": "CC0",
      "notes": 35,
      "instrumentTypes": [
        "Kick",
        "Snare",
        "Hihat"
      ]
    }
  ],
  "songs": [
    {
      "type": "song",
      "name": "Example Song",
      "url": "permalink",
      "hash": "3972dc9744f6499f0f9b2dbf76696f2ae7ad8af9b23dde66d6af86c9dfb36986",
      "author": "Name",
      "description": "Some info text explaining the artifact",
      "version": 4,
      "formatVersion": 1,
      "tags": [],
      "size": 79463,
      "license": "CC0",
      "patterns": 10
    }
  ],
  "drumkits": [
    {
      "type": "drumkit",
      "name": "Example Drumkit",
      "url": "permalink",
      "hash": "3972dc9744f6499f0f9b2dbf76696f2ae7ad8af9b23dde66d6af86c9dfb36986",
      "author": "Name",
      "description": "Some info text explaining the artifact",
      "version": 1,
      "formatVersion": 2,
      "tags": [
        "GM Midi",
        "Rock"
      ],
      "size": 864397,
      "license": "CC0",
      "folderName": "example kit",
      "instruments": 12,
      "components": 16,
      "samples": 164,
      "instrumentTypes": [
        "Kick",
        "Snare",
        "Hihat",
        "Crash",
        "Crash 2",
        "Tom Low"
      ]
    }
  ],
  "hash": "776aa3fd387d517b6799181389efe2e9baf51fe03e2ede17c9488daf3b13883d"
}
